{
  "schema_version": 1,
  "matrix_id": "altshuller_39x39",
  "improving_param_id": "9",
  "worsening_param_id": "14",
  "improving_rationale": "improving rationale text",
  "worsening_rationale": "worsening rationale text",
  "alternatives": [],
  "mapping_confidence": "high",
  "no_clean_mapping": false
}